igoID,igoAbbr,igoShortName,igoLongName,StartYear,EndYear,EndReason,Notes
3820,OCCEDCA,Org. of Coord. for Control of Endemic Diseases in Cent. Afr.,Organization of Coordination for the Control of Endemic Diseases in Central Afri,1963,,None,
3780,OCR,Org for the Collaboration of Railways,Organization for the Collaboration of Railways/WP states/ Organization of Railwa,1956,,None,
3750,OECD,Org for Econ Coop and Development,Organization for Economic Cooperation and Development (OECD),1961,,None,
3830,OECS,Org. Eastern Caribbean States,Organization of Eastern Caribbean States (OECS),1981,,None,
3762,OEEC,Org for European Economic Coop,Organization for European Economic Cooperation (Organization for Economic Cooper,1948,1961,replaced,
3740,OESAS,Observatorie economique statistique sub-saharan Afr.,Observatoire conomique et statistique d'Afrique subsaharienne,1993,,None,
3850,OIC,Org. Islamic Conference,Organization of the Islamic Conference (OIC),1969,,None,
3245,OIV,International Organization of Vine and Wine,International Organization of Vine and Wine,2004,,None,
3790,OMDKR,Org. Management & Dev. of Kaegara River,Organization for the Management and Development of the Kagera River,1977,2000,None,
280,OPANAL,Agency for Prohib. of Nuclear Arms in Latin Am.,Agency for the Prohibition of Nuclear Weapons in Latin America and the,1969,,None,
3840,OPEC,Org of Petroleum Exporting Countries,Organization of Petroleum Exporting Countries (OPEC),1960,,None,
3770,OSCE,Org. Security Cooperation Europe,Organization for Security and Cooperation in Europe (OSCE),1973,,None,
3855,OSLO,Oslo Commission,Oslo Commission,1972,1998,None,
3860,OSPAR,OSPAR Commission,OSPAR Commission,1998,,None,
1090,OTIF,Central Office for Intl Railway Transport,Central Office for International Railway Transport/OTIF,1890,,None,
3925,PAHC,Perm Assoc PanAm Highway Congresses,Permanent Association of Pan American Highway Congresses,1939,1952,None,
3890,PAHO,Pan-Am Health Org,Pan American Sanitary Bureau (PASOrganization/PAHealthOrganization),1902,,None,
3880,PAIGH,Pan Am Instit of Geog & Hist,Pan American Institute of Geography and History,1928,,None,
3875,PAP,Pan-African Parliament,Pan-African Parliament,2002,,None,WEBSITE: http://www.gene.ch/gentech/2002/Feb/msg00125.html NOTES: ;WEBSITE: http://www.benproject.org/ NOTES: ;WEBSITE: http://www.cslforum.org/ NOTES: ;WEBSITE: www.rainforestcoalition.org NOTES: 
3910,PC,Paris Commission,Paris Commission (PARCOM),1977,1998,replaced,
3940,PCA,Permanent Court of Arbitration,Permanent Court of Arbitration,1899,,None,
3870,PCB,Pacific Cable-Board,Pacific Cable Board,1920,1948,None,
3930,PCSP,Perm Comm for Conserv Maritime South Pacific,Permanent Commission for the Conservation of the Maritime Resources of the South,1952,,None,
4000,PED,Pole European de Development,PÙle europÈen de dÈveloppement (PED),1985,,None,
3950,PIARC,World Road Assn,Permanent International Association of Road Congresses/ World Road Association,1908,,None,
3960,PIBAC,Perm Intl Bureau Analytical Chem-Human & Animal,Permanent International Bureau of the Analytical Chemistry of Human and Animal F,1923,1934,replaced,
3970,PICDCS,Perm. Interstate Comm. for Drought Control in the Sahel,Permanent Interstate Committee for Drought Control in the Sahel,1973,,None,
3720,PICES,North Pac. Marine Science Org.,North Pacific Marine Science Organization (PICES),1992,,None,
3965,PICS,Perm Intl Comm Studies Sanitary Equip,Permanent International Commission of Studies on Sanitary Equipment,1925,1938,None,
4200,PIF,Pacific Island Forum,South Pacific Forum (SPF),1971,,None,
3920,PIPD,Partners in Population & Development,Partners in Population and Development - A South-South Initiative,1994,,None,
4010,PMAESA,Port Management Assoc. of E. and S. Africa,Port Management Association of Eastern and Southern Africa (PMAESA),1973,,None,
4035,PSI,Proliferation Security Initiative,Proliferation Security Initiative (PSI),2003,,None,WEBSITE: http://www.ghsi.ca/english/index.asp NOTES: ;WEBSITE: http://www.earthobservations.org/ NOTES: ;WEBSITE: http://www.icc-cpi.int/home.html&l=en NOTES: 
3980,PSNARCO,Perm. Sec. of the S. Am. Agr. on Narcotic Drugs,Permanent Secretariat of the South American Agreement on Narcotic Drugs and Psyc,1979,1998,None,
4030,PTASEA,Pref Trade Area: S & E Africa,Preferential Trade Agreement for Southern & Eastern Africa,1981,1993,replaced,
4020,PUASP,"Postal Union of Am, Spain, Port","Postal Union of the Americas and Spain/Postal Union of the Americas, Spain, and ",1911,,None,
4050,RASCOM,Reg. Afr. Satellite Comm. Org.,Regional African Satellite Communications Organization (RASCOM),1992,,None,
4080,RCAELA,Reg. Council for Adult Educ. & Literacy in Africa,Regional Council for Adult Education and Literacy in Africa,1974,,None,
4060,RCC,Reg Commonwealth in the Field of Comm,Regional Commonwealth in the Field of Communications (RCC),1991,,None,
4055,RECSA,Regional Centre on Small Arms and Light Weapons,Regional Centre on Small Arms and Light Weapons (RECSA),2004,,None,"WEBSITE: http://www.nwhf.no/ NOTES:   Website (accessed 10/31/08) indicates that Board of Governors consists of reps from UNESCO plus 5 states: Norway, Denmark, Finland, Iceland, Sweden.;WEBSITE: http://www.africa-union.org/root/au/organs/Pan-African_Parliament_en.htm NOTES: "
4090,RIMMO,Reserve internationale medit. occidentale,RÈserve internationale maritime en mÈditerranÈe occidentale (RIMMO),1992,,None,
3060,RIOPPAH,Intl Reg Org against Plant & Animal Disease,International Regional Organization against Plant and Animal Diseases/Internatio,1953,,None,
4100,RIOgroup,Rio Group,Rio Group,1986,,None,
4040,RadioU,Radiotelegraph Union,Radiotelegraph Union,1906,1926,None,
4085,RepCom,Reparation Commission,Reparation Commission,1919,1933,None,
4270,SAAFA,Special Arab Aid Fund for Africa,Special Arab Aid Fund for Africa (SAAFA),1974,1977,None,
4170,SAARC,South Asian Assoc Regional Coop,South Asian Association for Regional Cooperation (SAARC),1985,,None,
4160,SACEP,S. Asia Coop. Environment Prog.,South Asia Cooperative Environment Programme (SACEP),1983,,None,
4240,SACU,Southern African CU,Southern African Customs Union (SACU),1969,,None,
4250,SADC,Southern African Dev. Community,Southern African Development Community (SADC),1992,,None,
4251,SADCC,Southern African Dev. Coordination Conf.,Southern African Development Coordination Conference (SADCC),1980,1992,replaced,
4140,SAMI,Societe arabe des mines de l'Inchiri,Soci t arabe des mines de l'Inchiri (SAMIN),1980,,None,
4230,SARTC,Souoth African Regional Tourism Council,Southern Africa Regional Tourism Council (SARTOC),1973,1996,None,
4280,SCA,Suez Canal Admin,Suez Canal Administration,1888,1914,None,
4110,SCAf,Scientific Council in SSA,Scientific Council for Africa South of the Sahara,1950,1965,None,
4300,SCH,Superior Council of Health,Superior Council of Health,1838,1914,None,
1930,SCHENGEN,Group of Schengen,Group of Schengen,1985,1999,integrated,
4220,SEAMEO,Southeast Asian Minist. of Educ. Org.,Southeast Asian Ministers of Education Organization (SEAMEO),1965,,None,
4210,SEATO,Southeast Asia Treaty Organization,Southeast Asia Treaty Organization (SEATO),1956,1977,None,
2015,SEGIB,Ibero-American General Secretariat,Ibero-American General Secretariat (SEGIB),2003,,None,WEBSITE: http://www.earthobservations.org/ NOTES: ;WEBSITE: http://www.icc-cpi.int/home.html&l=en NOTES: ;WEBSITE: http://www.2ie-edu.org/ NOTES: 
3390,SELA,Latin American Economic System,Latin American Economic System/SELA,1975,,None,
990,SICA,Central American Integration System,Central American Integration System (SICA),1991,,None,
1890,SIECA,General Treaty on Cent Am Econ Integration,General Treaty on Central American Economic Integration/Permanent Secretariate o,1960,,None,
4180,SITTDEC,"South Investment, Trade & Tech. Data Exchg. Center","South Investment, Trade and Technological Data Exchange Centre",1990,,None,
4190,SPC,South Pacific Comm,South Pacific Commission/Secretariat of the Pacific Commission (SPC),1947,,None,
4130,SRDO,Senegal River Dev. Org.,Senegal River Development Organization,1972,,None,
4150,SWAPU,South & West African Postal Union,South and West Asia Postal Union (SWAPU),1987,2002,None,
4265,SWPD,South-West Pacific Dialogue,South-West Pacific Dialogue (SWPD),2002,,None,"WEBSITE: http://www.kbri-canberra.org.au/press/press041203e_deplu.htm - http://www.dfat.gov.au/asean/joint_media_statement.html - www.mne.gov.tl/en/index.php?option=com_content&view=article&id=20&Itemid=55 NOTES: ;WEBSITE: http://portal.unesco.org/education/en/ev.php-URL_ID=31056&URL_DO=DO_TOPIC&URL_SECTION=201.html - www.lins.no/events/NETF%20Completion%2007%20Presentations/FAPED%20Program.ppt - www.dakar.unesco.org/news/faped/en/020131_faped.shtml NOTES:   Dakar Website (accessed 11/1/08): [lists Mauritius,  Namibia, Senegal, Sudan, Tanzania as the countries that participated in drafting Charter in 2002].  YIO lists as H (Inactive), but Power Point presentation website from 2007 indicates it is;WEBSITE: http://www.unctad.org/infocomm/anglais/rubber/ecopolicies.htm#ITRO NOTES: ;WEBSITE: Website NOTES: Notes"
4290,SugU,Sugar Union,Sugar Union,1902,1913,None,
4330,TARHEC,Tropical Ag. Research & Higher Educ. Center,Tropical Agriculture Research and Higher Education Center,1973,,None,
4320,TCRMG,Tripartite Agreement for Monetary Gold,Tripartite Commission for the Restitution of Monetary Gold,1946,1998,None,
4310,TIC,Trade/Invest Council,Trade and Investment Council,1998,,None,
3330,Turksoy,Joint Admin. of Turkish Culture & Arts,Joint Administration of the Turkic Culture and Arts (TURKSOY),1993,,None,
4380,UASC,United Arab Shipping Co.,United Arab Shipping Company (UASC),1976,,None,
4370,UBEC,Union of Banana Exporting Countries,Union of Banana Exporting Countries,1974,1996,None,
940,UDEAC,Central African Customs & Economic Union,Central African Customs and Economic Union (UDEAC),1964,1994,replaced,
4340,UEMOA,West African Economic & Monetary Union,Union conomique et mon taire Ouest africaine (UEMOA),1994,,None,
4350,UIUCV,Union for Intl Use of Carriages & Vans,Union for the International Use of Carriages and Vans,1923,1979,None,
4390,UKDWD,UK Dominion Wool Disposals,United Kingdom--Dominion Wool Disposals,1945,1953,None,
4365,UMAC,Central African Monetary Union,Union montaire de l'Afrique centrale (UMAC),1972,1994,replaced,
4503,UMOA,West African Monetary Union,West African Monetary Union/UMOA,1962,1994,integrated,
4400,UN,United Nations,United Nations,1945,,None,
2790,UNDROIT,Intl Instit for Unification of Private Law,International Institute for the Unification of Private Law/UNIDROIT,1926,,None,
4410,UNESCO,"UN Education, Scientific, & Cultural Org","United Nations Educational, Scientific, and Cultural Organization (UNESCO)",1945,,None,
4420,UNIDO,UN Industrial Development Org,United Nations Industrial Development Organization (UNIDO),1966,,None,
4430,UPU,Universal Postal Union,Universal Postal Union,1874,,None,
4440,USP,Univ. of South Pacific,University of the South Pacific (USP),1967,,None,
1940,VALDIVIA,Group of S. Hemisp. Countries on Env.,Group of Temperate Southern Hemisphere Countries on the Environment/VALDIVA Grou,1995,,None,
4450,VASAB,Vision & Strategies Around Baltic Sea,Vision and Strategies around the Baltic Sea 2010 (VASAB 2010),1992,,None,
4490,WAEC,West Afr. Examinations Council,West African Examinations Council,1951,,None,
4500,WAHC,West African Health Community,West African Health Community (WAHC),1972,1987,None,
4501,WAHO,West African Health Organization,West African Health Organization,1988,,None,
4480,WARDA,West Africa Rice Dev. Assoc.,West Africa Rice Development Association (WARDA),1970,,None,
4540,WCDC,Working Community of Danube Countries,Working Community of the Danube Countries,1990,,None,
1650,WCO,World Customs Org,European Customs Union Study Group (Customs Cooperation Council) (World Customs,1950,,None,
4510,WEU,Western European Union,Western European Union (WEU),1955,,None,
4550,WHO,World Health Org,World Health Organization,1946,,None,
4560,WIPO,World Intell Prop Org,World Intellectual Property Organization (WIPO),1967,,None,
4530,WMO,World Meteorological Org,World Meteorological Organization,1947,,None,
4520,WNF,West Nordic Fund,West-Nordic Foundation,1987,,None,
4460,WPact,Warsaw Treaty Org,Warsaw Treaty Organization,1955,1991,None,
4580,WTO,World Trade Org,World Trade Organization (WTO),1995,,None,
4570,WTOURO,World Tourism Org.,World Tourism Organization (WTO),1975,,None,
4470,Wassen,Wassenaar Arrangement,Wassenaar Arrangement on Export Controls for Conventional Arms and,1996,,None,
